4329508,ANTECEDENTES,AINES,ALERGIAS,ALIMENTOS,ANTIBIOTICOS,PATOLOGICOS,QUIRURGICOS,FUNCIONES BIOLOGICAS,OTROS SINTOMAS,CARDIOVASCULAR,FUNCIONES VITALES,RESPIRATORIO,DIAGNOSTICO,MEDICAMENTOS
nan, ALERGIA,NIEGA AINES,   NIEGA OTRO ALERGIA,   NIEGA ALIMENTO,   NIEGA ANTIBIOTICOS,   DIABETES,   NIEGA QUIRURGICO,  APETITO NORMAL,  SIN SINTOMAS,   INTENSIDAD REGULAR,   FC: 80,  MURMULLO VESICULAR, I10.X - HIPERTENSION ESENCIAL (PRIMARIA) (PRINC), CLOPIDOGREL 75MG TAB REC CJA X 14 - GENFAR - 60 - TABLETA - ORAL - 1.00 TAB CADA 24 HRS. DURANTE 30
nan,nan,nan,nan,nan,nan,   HIPERTENSION,nan,  DEPOSICION NORMAL,nan,  RUIDO CARDIACO,   FR: 16,   MURMULLO VESICULAR NORMAL,nan, LOSARTAN 50MG TAB. REC CJA X 60 (TEVA) - 120 - TABLETA - ORAL - 1.00 TAB CADA 12 HRS. DURANTE 30
nan,nan,nan,nan,nan,nan,nan,nan,  ORINA NORMAL,nan,   RUIDO RITMICO,   PA DIASTOLICA: 60,nan,nan,nan
nan,nan,nan,nan,nan,nan,nan,nan,  SED NORMAL,nan,nan,   PA SISTOLICA: 120,nan,nan,nan
nan,nan,nan,nan,nan,nan,nan,nan,  SUENO NORMAL,nan,nan,nan,nan,nan,nan
